review_id,source,created_date,review_content,rating,author_masked,product_category
PLAY_coupang_000950,google_play,2025-12-24,라면은 다 부숴져서 오고 가격도 그닥 싸지도 않고 배송이 빠른 거 제외하곤 장점이 없다 개인정보 유출도 모자라서 한국인을 개무시하는 업체는 더이상 이용할 가치가 없다고 판단되어 탈퇴합니다 폭망을 기원합니다,1,s*********,쿠팡
PLAY_coupang_000951,google_play,2025-12-24,쿠팡은 오너의 잘 못된 판단이 독이 될듯 나쁜 기업임,1,G*********,쿠팡
PLAY_coupang_000952,google_play,2025-12-24,대한민국 고객을 우숩게여기는 기업. 탈퇴합니다 ~,1,G********,쿠팡
PLAY_coupang_000953,google_play,2025-12-24,사기제품을 분별할 마음이 없으면 사용자가 판매자를 차단하는 기능이라도 좀 넣는게 맞지 않나 싶네요,1,김**,쿠팡
PLAY_coupang_000954,google_play,2025-12-23,오너 마인드가 노답,1,H**********,쿠팡
PLAY_coupang_000956,google_play,2025-12-23,오! ㅇㅅㅇ이 좋아하는 쿠팡!,5,m******,쿠팡
PLAY_coupang_000957,google_play,2025-12-23,쿠팡이츠 타인명의 결제는 안 되나요? 그리고 쿠팡이츠는 결제수단 변경 메뉴같은 건 안보이고 머니랑 계좌결제만 있어요. 카드 결제는 안 되나요? 쿠팡이츠도 타인명의 카드로도 결제할 수 있게 해주시면 안 되는지요 그리고 앱 업데이트 하고나서 쿠팡 결제시 기본수단으로 설정(?)체크박스 메뉴가 안보여서 마지막 결제한 카드로 자동 변경되는데 기본수단 설정 체크박스 메뉴 버튼 어딨는지요..,3,Y***********,쿠팡
PLAY_coupang_000958,google_play,2025-12-23,한국 업신여기는 나쁜 기업이 운영합니다.,1,D*************,쿠팡
PLAY_coupang_000959,google_play,2025-12-23,보안꽝 물건값 불투명함 고객을 위한 서비스접근 불편함,1,정**,쿠팡
PLAY_coupang_000960,google_play,2025-12-23,쿠팡 벌써 보이스피싱 전화가 오는데 어떻게 하실건가요?,1,김*,쿠팡
PLAY_coupang_000961,google_play,2025-12-23,광고 보기싫음 인터넷키면 다 광고야 아니 비밀번호 찿기가서 변경 설정을 눌러도 안넘어가지네요 앱말고 인터넷사이트 로그인을 못해,3,양**,쿠팡
PLAY_coupang_000962,google_play,2025-12-23,에휴......ㅉㅉ,1,이**,쿠팡
PLAY_coupang_000963,google_play,2025-12-23,이미 수신거부의사를 밝혔는데도 수시로 뜨는 광고 수신 선택 알림. 잘못 누르면 설정 들어가서 또 바꿔야되고.정신좀 차려라 쿠팡 앱 관리자~!!! 초기부터 사용한 소비자인데 개선이 안돼네. 삭제하고 쿠팡은 이제 빠이빠이~~~~ 이번 해깅하고는 상관없음.,1,R***********,쿠팡
PLAY_coupang_000965,google_play,2025-12-23,쿠팡은 사과해라!!! 여기 구매하기 전엔 ㅈ마켓 사용했지만 요세 하는짓보니 꼴보기 싫어진다 인간은 적응의동물... 새벽배송 없어도 다시 돌아가야 겠다 ㅈ마켓으로 잘있어라 쿠팡!!!,1,김**,쿠팡
PLAY_coupang_000966,google_play,2025-12-23,개인정보유출 보상해라,1,잡**,쿠팡
PLAY_coupang_000967,google_play,2025-12-23,노동자는 일회용이 아니다!,1,김**,쿠팡
PLAY_coupang_000968,google_play,2025-12-23,노동자 소비자 우롱하는 기업퇴출합시다,1,정**,쿠팡
PLAY_coupang_000969,google_play,2025-12-23,탈퇴하려면 업데이트 해야하네 짜증나게,1,이*****,쿠팡
PLAY_coupang_000970,google_play,2025-12-23,쿠팡 유사 앱마켓 콕팡 나와라. 따라만해도 싹다갈아탄다,1,a******,쿠팡
PLAY_coupang_000971,google_play,2025-12-23,"그동안 쿠팡을 이용하면서 주문이 간편하고, 상품가격이 비교적 저렴했고, 배송도 빨라서 좋았던 거 같습니다. 반면에 쿠팡기업에서 근무하는 모든 노동자들의 피와 땀, 노력 덕분이겠죠. 그런데 매년 쿠팡 배송기사분들 사망소식이 들려오고, 25년에는 개인정보가 유출되었는데 기업에서 빠른시일 내에 어떠한 조취도 취하지 않아서 믿음이 가지 않게 되었습니다. 앞으로는 탈팡을 하려고 합니다.",1,G*********,쿠팡
PLAY_coupang_000972,google_play,2025-12-23,탈팡! 악덕기업 OUT!,1,K*****,쿠팡
PLAY_coupang_000973,google_play,2025-12-23,개인정보유출 하는 앱,1,H*****,쿠팡
PLAY_coupang_000975,google_play,2025-12-22,탈퇴 어떻게 하나요? 보안및 로그인 들어가면 403어쩌고 뜨는데,1,c****,쿠팡
PLAY_coupang_000976,google_play,2025-12-22,그냥 느낌상 좋음 그런데 작금의 사태를 대하는 행태를 뉴스로 들어보니 인성이 좀 부족해 보여서 ...,2,띠******,쿠팡
PLAY_coupang_000977,google_play,2025-12-22,쿠팡 실망스럽습니다 회원탈퇴했고 다시는 안쓸랍니다,1,꼬***,쿠팡
PLAY_coupang_000978,google_play,2025-12-22,개인정보 유출 후 태도가 너무 적반하장이라 와우멤버십 바로 해지했습니다. 앱도 이제 안 쓸듯해요.,1,냠*,쿠팡
PLAY_coupang_000979,google_play,2025-12-22,한국에서 장사 접으시길,1,J********,쿠팡
PLAY_coupang_000980,google_play,2025-12-22,국민이 호구입니까? 탈퇴합니다,1,김*,쿠팡
PLAY_coupang_000981,google_play,2025-12-22,광고좀 그만 좀 해라 뒤로가기 불편하다,1,김**,쿠팡
PLAY_coupang_000982,google_play,2025-12-22,세상 최악의 기업이라고 생각합니다. 그런 마인드로 구멍가게 운영할 그릇도 깜냥도 안되는 퇴출이 답입니다.,1,C********,쿠팡
PLAY_coupang_000983,google_play,2025-12-22,아니 요즘 불쌍해서 좀 좋게 말하려 했는데 왜 어플 키면 로그인 창이 뭘 누를때마다 나옴 ㅋㅋㅋㅋㅋ 겁나 무섭네 미국 기업은 원래 이따구로 하나? 미국에서 이러면 큰일 날텐데 중국 놈들이야 제버릇 남 못준거라 쳐도,1,G******,쿠팡
PLAY_coupang_000984,google_play,2025-12-22,탈퇴하려니까 탈퇴창에서만 인터넷 오류ㅋㅋ 근데 다른 주문 페이지는 멀쩡하게 들어가짐ㅋㅋ 장난하냐,1,S***********,쿠팡
PLAY_coupang_000985,google_play,2025-12-22,여기가 망햇다는 쿠팡인가요??,1,안*,쿠팡
PLAY_coupang_000986,google_play,2025-12-22,나는 여전히 쿠팡이 좋습니다.,5,이**,쿠팡
PLAY_coupang_000987,google_play,2025-12-22,해외 본사라 국내 책임 안 져도된다는 태도 잘 봤습니다,1,임**,쿠팡
PLAY_coupang_000988,google_play,2025-12-22,탈퇴 하는 것도 겁나게 힘들게 해났어요.지긋지긋하다. 어쨋든 탈퇴해서 속이 다 시원하네. 쫄딱 망해버려~!,1,R*****,쿠팡
PLAY_coupang_000989,google_play,2025-12-22,여기 댓글들 진짜로 이상하네.. 댓글 알바들 개거품 물고 아주 악을 쓰네;,5,집**,쿠팡
PLAY_coupang_000990,google_play,2025-12-22,판매자 주주베 재고있어서 구매했는데 상품준비중이라 기다렸다.판매자배송이니까.아무튼 4일만에 저녁 늦게 재고품절이라 지멋대로 주문취소하고 문의하니까 주문량이늘어서 취소했데 와 진짜 어의없네ㅋㅋㅋ결제한순으로 상품보내야되는거아니야?,1,이**,쿠팡
PLAY_coupang_000992,google_play,2025-12-22,쓰레기 기업..... 로켓배송 몇개시키면 배송 비닐 둘둘둘 크기에 안맞는 박스에 대충 넣고..한개씩 따로포장... 쓰레기 만드는기업 그리고 대표마인드도 그러할줄은...,1,c******,쿠팡
PLAY_coupang_000994,google_play,2025-12-22,쿠팡은 자신의 잘 못을 알라 별 하나도 아깝다.,1,최**,쿠팡
PLAY_coupang_000997,google_play,2025-12-22,한국에서 퇴출시켜야할 기업 1위,1,소*********,쿠팡
PLAY_coupang_000998,google_play,2025-12-22,고객의 개인정보 유출에 대해 더 심각한 접근이 필요함.,1,s***,쿠팡
PLAY_coupang_000999,google_play,2025-12-22,돈은 한국에서 벌고 기부는 미국에다 하고 채용은 중국인을 하는 기업,1,b****,쿠팡
PLAY_coupang_001000,google_play,2025-12-22,"내인생 보이스피싱 전화 받아본적 없었는데, 쿠팡개인정보 유출사건이후 처음 받아봤다. 잘 있어라",1,정**,쿠팡
PLAY_coupang_001001,google_play,2025-12-22,개인정보 유출업체의 어플리케이션으로 고객의 개인정보가 관리되지 않습니다 그리고 고객정보 유출 관련하여 어떤한 책임도 없다고 주장하는 외국계 기업 입니다,1,최**,쿠팡
PLAY_coupang_001002,google_play,2025-12-22,쿠팡이라는 앱은 참 쇼핑하기 편리한 앱인 것 인정합니다 하지만 제가 사용을 계속 해보다보니 단점이 좀 있습니다 단점이 무엇이냐면은 제품이 잘 되지 않거나 제품의 품질이라든지 충전이 안되는 등 이상한게 있습니다 이런점은 보완이 필요할 것 같습니다 하루 빨리 보완해주셔서 더 좋은 제품을 판매해주시길 바랍니다!,5,호***,쿠팡
PLAY_coupang_001003,google_play,2025-12-22,애ㆍ자꾸 강제로 자동으로 원터치결제가 되도록 설정을 변경합니까? 강제로 변경시켜놓고 피씨에서 설정변경할수없게 그 항목을 아예 없애버리고는 앱에서만 다시 변경 가능하다는게 말이된다고 생각합니까? 한두번도 아니고 주기적으로 이렇게 더러운 장난질을 계속 치는 이유는 어거지로 앱을 설치하게 하려는 거잖아요? 고격정보 유출시케 난리난 이 상황에도 여전히 이런 말도 안되는 짓을 하다니 도저히 이해할수가 없네요.,1,S****************,쿠팡
PLAY_coupang_001004,google_play,2025-12-22,필요성을 느끼지 못해서 탈퇴 후 삭제했어요.,1,C****************,쿠팡
PLAY_coupang_001005,google_play,2025-12-22,한국인 무시하는 악덕기업,1,l*********,쿠팡
PLAY_coupang_001006,google_play,2025-12-22,물건 결제하기전에 뭔 우월회원 가입시키냐 모르고 방치면 계속 결재돼개설계돼있내 패치안하면 따로 신고넣어야지,1,프***,쿠팡
PLAY_coupang_001007,google_play,2025-12-22,인생을 좋게 만들어주고 있음,5,G***********,쿠팡
PLAY_coupang_001008,google_play,2025-12-22,폰 명의자가 바뀌어 로그아웃하려고 아무리 찾아도 없네요?,5,이**,쿠팡
PLAY_coupang_001010,google_play,2025-12-21,영업정지 필요 기업. 딱 1달 가자,1,찌******,쿠팡
PLAY_coupang_001011,google_play,2025-12-21,NO COUPANG 사지않습니다,1,장**,쿠팡
PLAY_coupang_001012,google_play,2025-12-21,긴 세월 사용했지만 대한민국에서 운영하는 비 도덕적 행위를 보고 탈팡,1,P****************,쿠팡
PLAY_coupang_001013,google_play,2025-12-21,넌 이제 안쓴다 개인정보 다 털어놓고 보상을 안해주는건 좀 그래;;,1,g*********,쿠팡
PLAY_coupang_001016,google_play,2025-12-21,광고 포털마다 개같이 얍삽하게 띠우네.. 사라져야할 기업 1위2위 쿠팡 배민,1,아******,쿠팡
PLAY_coupang_001017,google_play,2025-12-21,최악의 무책임한 업체. 대만에서나 해라 ㅋ,1,B*********,쿠팡
PLAY_coupang_001020,google_play,2025-12-21,난 쿠팡만쓸거다 쿠팡이여 영원하라~,5,김**,쿠팡
PLAY_coupang_001021,google_play,2025-12-21,한국에서 돈벌고 미국에만 기부하니? 그래서 탈퇴합니다,1,s*******,쿠팡
PLAY_coupang_001022,google_play,2025-12-21,개인정보유출 제대로 후속처리하라,1,박**,쿠팡
PLAY_coupang_001023,google_play,2025-12-21,배송만 빨랐지 물건이 회손되서 받은 적이 엄청 많아요. 다시는 이용하고싶지 않아요.,1,J*******,쿠팡
PLAY_coupang_001024,google_play,2025-12-21,"저질기업, 퇴출이 답이다.",1,J*********,쿠팡
PLAY_coupang_001026,google_play,2025-12-21,1. 가끔씩 포장상태가 불량함. 상품 크기 대비 과도한 박스 포장과 내용물이 찌그러지는 경우 발생 2. 개인정보 보호에 대한 확신이 서지 않음,1,J**********,쿠팡
PLAY_coupang_001027,google_play,2025-12-21,개인정보 유출사건 보고 알았다. 나는 돌아올 생각이 없어요. 보안구멍. 쿠팡 퇴출. 한국에서 나가라. 나는.. 네이버쇼핑 이용합니다. 잘가라. 잘가게.,1,사*******,쿠팡
PLAY_coupang_001028,google_play,2025-12-21,휴대폰 바껴서 로그인하는대 데이터전송실패라고뜨는대이건 뭔가요 외 로그인 안되나요,1,이**,쿠팡
PLAY_coupang_001029,google_play,2025-12-21,내개인정보팔아먹고 보상도없고 사과도 대충하는 뻔뻔한 오너를 둔죄 광고 양아치스럽게해놔서 짜증유발 그 오너에 그 광고. 원성사지마 그거 어디안가,1,박**,쿠팡
PLAY_coupang_001034,google_play,2025-12-21,야 쿠팡 광고 짜증나게 하지말고 회원들 고객관리나 잘해라...광고 나오는거 보다가 쿠팡 꼴도 보기 씨러졌다,1,박**,쿠팡
PLAY_coupang_001037,google_play,2025-12-20,아니.장바구니에 뭐 담을때마다 광고계속떠요. 7일간안보기.체크해도 계속뜸..문의하니.어플삭제하고 다시 설치하라는데. 그냥 삭제하고 쿠팡안쓸랴요. 지금 이 시국에 쿠팡와우카드 발급받으라는 광고를 띄우는게 맞아요?,1,J***********,쿠팡
PLAY_coupang_001038,google_play,2025-12-20,아직도 탈퇴 안했냐? 지독하다. 지독해.,1,1*******,쿠팡
PLAY_coupang_001039,google_play,2025-12-20,앱 ui가 너무 난해함,1,슈****,쿠팡
PLAY_coupang_001040,google_play,2025-12-20,글로벌 기업 ㅋㅋㅋㅋㅋㅋㅋㅋㅋ,1,1*********,쿠팡
PLAY_coupang_001042,google_play,2025-12-20,응원합니다. 쿠팡에 종사하시는 분들덕에 삶의 질이 올라갔습니다.,5,p*********,쿠팡
PLAY_coupang_001043,google_play,2025-12-20,소비자를 호구로 아는 기업에 더이상 미련이 없음.,1,아**,쿠팡
PLAY_coupang_001044,google_play,2025-12-20,이런 사업자는 퇴출되어야 함,1,민*,쿠팡
PLAY_coupang_001045,google_play,2025-12-20,"예전에는 로켓배송이 19,800원이 안넘어도 무료배송에다가 바로결제가 됬는데 지금은 왜 19,800원이 넘어야만 결제가되나요??? 제발이거 예전처럼 바꿔주세요 너무 불편합니다 ㅜㅜ",3,송**,쿠팡
PLAY_coupang_001047,google_play,2025-12-20,탈퇴해서 속이다 후련하네요,1,오**,쿠팡
PLAY_coupang_001048,google_play,2025-12-20,별한개도 아깝다 반성도개선도없는 회사,1,허**,쿠팡
PLAY_coupang_001049,google_play,2025-12-20,돈은 한국에서 벌지만 한국 소비자 기만하는 쿠팡 아웃,1,농***,쿠팡
PLAY_coupang_001050,google_play,2025-12-20,이번에 청문회 잘봤다 아주 대한민국 국민 동물로 봤다이거지 난 탈퇴한다 나하나 탈퇴한다고 눈하나 깜짝하것냐만은 내가 시작이되길,1,박**,쿠팡
PLAY_coupang_001053,google_play,2025-12-20,사용하기 불편함...,1,H***********,쿠팡
PLAY_coupang_001054,google_play,2025-12-20,별점 마이너스는 없나요,1,z*****,쿠팡
PLAY_coupang_001055,google_play,2025-12-20,악덕기업 다시는 사용 안한다,1,석**,쿠팡
PLAY_coupang_001056,google_play,2025-12-20,한개도 아니고. 연속으로. 3개나. 불량품 보내는건. 이건좀 아는듯 하네. 보조배터리 30 분 만에 고장. 골전도이어폰 2개 구매했어는데. 한개는 골전도가 아니고 한개 골에 안붙고 떨어져. 착용되고 그리고 전선부위가 떨어져. 전선이 다보이고. 쿠팡 탈퇴 하기전. 궁금해서. 왜 이러는거냐,1,학**,쿠팡
PLAY_coupang_001057,google_play,2025-12-20,탈퇴하려고 회원정보수정들어가니 네트워크에러로 안들어가네요. 와이파이 lte 둘다 안되네요. 쿠팡내 다른곳들은 정상접속되는데 회원장보수정만 안되는건 이거회원탈퇴 못하게 일부로 막는거 아닌가요??,1,우*,쿠팡
PLAY_coupang_001058,google_play,2025-12-20,장사 그따구로 하지 말아라,1,임**,쿠팡
PLAY_coupang_001059,google_play,2025-12-20,"쿠팡 사장의 답변에 제 대가리를 팍 치고, 역시 미국 기업이구나!!하며 탈퇴합니다^^b",1,마*******,쿠팡
PLAY_coupang_001060,google_play,2025-12-20,"2025. 12. 20. 대규모 해킹사태 이후 전에 없던 피싱 전화, 스캠 문자가 오기 시작. 웹페이지에서 앱으로 강제 이동되는 납치 광고는 언제 고칠지.",1,T*********************,쿠팡
PLAY_coupang_001061,google_play,2025-12-20,"고객정보보호 소홀, 한국소비자 무시",1,P********,쿠팡
PLAY_coupang_001062,google_play,2025-12-20,범죄자 검머외가 운영하는 비윤리적 기업,1,J**,쿠팡
PLAY_coupang_001063,google_play,2025-12-20,개인정보관리미흡 고객대처 미흡,1,전**,쿠팡
PLAY_coupang_001064,google_play,2025-12-20,최근 본 상품 카테고리 어디갔나요?!?!?!,4,따*,쿠팡
PLAY_coupang_001065,google_play,2025-12-20,무책임한 기업이라 삭제,1,J*********,쿠팡
PLAY_coupang_001066,google_play,2025-12-20,본질은 드러나게 되어있지,1,임**,쿠팡
PLAY_coupang_001067,google_play,2025-12-20,와우 회원 아니면 못 삼. 유료결제 해야지만 물건 시킬 수 있고 2만원이여서 담았는데 와우회원이여야 2만원에 살 수 있는 거고 뮤료회원은 막 6만원임. 처음부터 6만원이라 표시하던가 진짜 와우회원 아니면 사지도 못하는 거 너무 짜침,1,가****,쿠팡
PLAY_coupang_001068,google_play,2025-12-20,왜사업자아이디는 쿠팡플레이사용이안되나요ㅡ 개인회원만 쿠플된다는데 사업자도 볼수있게해주세요,3,은***,쿠팡
PLAY_coupang_001069,google_play,2025-12-20,"최악의 개인정보 유출 후 반 소비자 대응, 반성하지 않는 기업이 국내서 유통업을 이끄는건 정의가 아니라고 봄",1,J******************,쿠팡
PLAY_coupang_001070,google_play,2025-12-20,남의 개인정보나 털리는 저질 회사,1,덱***,쿠팡
PLAY_coupang_001071,google_play,2025-12-20,대한민국을 졸로보는 쓰레기 기업,1,j*********,쿠팡
PLAY_coupang_001073,google_play,2025-12-20,개인정보 유출되서 보이스피싱 문자 계속 전화옴. 10년 고객인데 앱 삭제함,1,n****,쿠팡
PLAY_coupang_001074,google_play,2025-12-20,대표 및 임원진의 대처 미흡으로 인한 신뢰도 하락,1,이****,쿠팡
PLAY_coupang_001075,google_play,2025-12-20,쿠팡 이제 안녕이다. 너 아니어도 얼마든지 쓸수 있는 대체제가 있단다. 앱 삭제 회원탈퇴~ .다,1,박**,쿠팡
PLAY_coupang_001077,google_play,2025-12-20,다들 알고 있으므로 더이상 설명은 필요없다,1,n********,쿠팡
PLAY_coupang_001079,google_play,2025-12-20,에이~ 물건 이상한거 올때도 있고. 같은 물건도 가격이 천차만별이라 검색하다 노이로제 걸릴듯,1,이**,쿠팡
PLAY_coupang_001081,google_play,2025-12-20,도박앱 느낌. 쓸수록 보는눈이 좁아져요,1,윤**,쿠팡
PLAY_coupang_001082,google_play,2025-12-20,총 매출 90%가 우리나라에서 발생하는데 청문회에 출석조차 안하고 책임 회피만하는 꼬라지 보고 역겨워서 안씀,1,정*,쿠팡
PLAY_coupang_001083,google_play,2025-12-20,0점 주기도 아깝다,1,알******,쿠팡
PLAY_coupang_001084,google_play,2025-12-20,악덕기업 쿠팡 반성하라.,1,월*,쿠팡
PLAY_coupang_001085,google_play,2025-12-20,앱에서 최근본상품 아이콘 비활성화 해놓은 이유를 고객들에게 설명을 해줘야 되는거 아닙니까?,1,맑***,쿠팡
PLAY_coupang_001086,google_play,2025-12-20,이건 아니다. 사업접자.,1,역****,쿠팡
PLAY_coupang_001089,google_play,2025-12-20,고객 정보를 소중히 여기지 않는 악덕 기업 앱,1,J************,쿠팡
PLAY_coupang_001090,google_play,2025-12-20,악덕 기업 탈퇴하고 어플 삭제가 답이다. 삭제 완료,1,맑**,쿠팡
PLAY_coupang_001094,google_play,2025-12-19,미국 아마존은 못이기니까 한국에서 니가잘나가지?,1,김**,쿠팡
PLAY_coupang_001097,google_play,2025-12-19,"교묘하게 와우결제 유도하고, 그리고 국민을 우습게 아는 기업은 퇴출되어야 한다. 개인정보 다 유출하고, 사랑하는 가족이 있는 노동자가 쓰러져도 책임회피하고, 그 얼마 안되는 퇴직금 안주려고 꼼수 쓰고. 해도해도 너무 한거 아뇨?",1,D**********,쿠팡
PLAY_coupang_001098,google_play,2025-12-19,매우 별로임 내 정보 팔아서 돈번건 아닌지 의심이 감.,1,s***********,쿠팡
PLAY_coupang_001099,google_play,2025-12-19,너네 나라가서 장사해라,1,Y******,쿠팡
PLAY_coupang_001100,google_play,2025-12-19,국민 무시하는 외국기업.,1,H*****,쿠팡
PLAY_coupang_001101,google_play,2025-12-19,노동자의 죽음을 만만하게 보다니,1,G*******,쿠팡
PLAY_coupang_001102,google_play,2025-12-19,한국판 알리. 앱은 개쓰렉이고 배송하나때문에 사용하는데 가격이 비싸서 잘 알아보고 사야함. 내가 쿠팡에선 살 때는 빠른배송비값 지불한다고 생각하고 사면 합리적으로 구매 가능함. 알리같은 쓰렉이앱 드뎌 지웠다. 영원히 보지 말자. 그래도 쿠팡덕에 다른 쇼핑몰 배송이 빨라져서 그건 인정함.,1,K********,쿠팡
PLAY_coupang_001103,google_play,2025-12-19,소비자 우롱기업 아주 나쁜회사,1,돈****,쿠팡
PLAY_coupang_001104,google_play,2025-12-19,개인정보는 다 털리고 소비자는 우습게 아는 미국기업,1,M**********,쿠팡
PLAY_coupang_001105,google_play,2025-12-19,나쁜 소식만 나오니 이제 네이버로 갑니다. 마침 네이버도 새벽배송 추가되었네요 굿바이,1,K*********,쿠팡
PLAY_coupang_001106,google_play,2025-12-19,개인정보 고만 털어라,1,o,쿠팡
PLAY_coupang_001108,google_play,2025-12-19,"소비자 정보관리 허술, 고객모독",1,t************,쿠팡
PLAY_coupang_001109,google_play,2025-12-19,개인정보털림 사용하지마세요,1,로********,쿠팡
PLAY_coupang_001111,google_play,2025-12-19,서비스최악 불만족 고객무시,1,행*,쿠팡
PLAY_coupang_001112,google_play,2025-12-19,개인정보 다 털리는 서비스입니다.,1,J***,쿠팡
PLAY_coupang_001113,google_play,2025-12-19,"서비스 엉망에 고객 무시 최악의 회사이고, 여기저기 떠오르는 광고가 너무심합니다.",1,T*************,쿠팡
PLAY_coupang_001114,google_play,2025-12-19,엉망임. 인간성을 버리게 됨,1,조**,쿠팡
PLAY_coupang_001117,google_play,2025-12-19,내게는 최악의 기업,1,K******,쿠팡
PLAY_coupang_001118,google_play,2025-12-19,고객의 정보를 방치하듯 다루네요,1,최**,쿠팡
PLAY_coupang_001120,google_play,2025-12-19,여기가 법 위에 있다는 그 회사인가요? 아...영어로 써줘야 알아볼라나?,1,k**************,쿠팡
PLAY_coupang_001121,google_play,2025-12-19,한국인을 무시하는 보는 쿠팡,1,S***********,쿠팡
PLAY_coupang_001122,google_play,2025-12-19,the worst of the worst management the most egregiously bad management management at its absolute worst the lowest form of management,1,조**,쿠팡
PLAY_coupang_001123,google_play,2025-12-19,개인정보 유출 사태에 대한 후속 조치나 피해 고객에 대한 보상이 전혀 없네요. 탈퇴합니다.,1,c*****,쿠팡
PLAY_coupang_001124,google_play,2025-12-19,소비자에게 미흡한 대처,1,c***,쿠팡
PLAY_coupang_001127,google_play,2025-12-19,"사용환경이 매우 불쾌하고, 경영진 또한 쿠팡소비자를 전혀 배려치 않음",1,h***********,쿠팡
PLAY_coupang_001130,google_play,2025-12-19,"사용자가 해지를 원할 때 너무 어렵게 UI를 만들어 놓아, 매우 불편함. 유사(가짜)상품에 대한 필터링이 약함.",1,지***,쿠팡
PLAY_coupang_001131,google_play,2025-12-19,돈만 밝히는 업자들같음 개인정보보호 기본이 안됨,1,히*,쿠팡
PLAY_coupang_001133,google_play,2025-12-19,고객을 우습게 아는 이런 기업은 사용 않겠다,1,넷***,쿠팡
PLAY_coupang_001135,google_play,2025-12-19,한국을 호갱으로 여기는 기업임,1,C************,쿠팡
PLAY_coupang_001136,google_play,2025-12-19,이번에 얼마나 부도덕하고 형편없는 기업인지 잘 알았습니다. 멤버십해지하고 어플삭제했어요.,1,박**,쿠팡
PLAY_coupang_001138,google_play,2025-12-19,광고 납치 짜증나요. 절대 안사요.,1,심**,쿠팡
PLAY_coupang_001139,google_play,2025-12-19,소비자 무시.고용인 무시.OUT!,1,이**,쿠팡
PLAY_coupang_001141,google_play,2025-12-19,한국을 졸로 보네?,1,감***,쿠팡
PLAY_coupang_001142,google_play,2025-12-19,쿠팡 말고 다른 곳을 이용하기로 함.,1,B********,쿠팡
PLAY_coupang_001144,google_play,2025-12-19,개인 정보 다 털렸는데 그애 따른 대책이 없네요. 와우 회원 해지하고 앱 삭제 합니다.,1,이**,쿠팡
PLAY_coupang_001147,google_play,2025-12-19,한국 시장과 소비자 기만하는 악덕기업,1,L*****,쿠팡
PLAY_coupang_001148,google_play,2025-12-19,요즘 실망적인게 많습니다,1,김*********,쿠팡
PLAY_coupang_001150,google_play,2025-12-19,유출사고에 대한 고객응대가 별로네요 별 하나도 아깝습니다,1,3*,쿠팡
PLAY_coupang_001151,google_play,2025-12-19,최근 본 상품 메뉴가 없어졌어요! 못찾겠어요 최근 본 상품 없어져서 불편해요ㅠㅠ다시 돌려주세요!!,2,H*******,쿠팡
PLAY_coupang_001152,google_play,2025-12-19,정보유출? 도난 아니냐?,1,두***,쿠팡
PLAY_coupang_001153,google_play,2025-12-19,비번 변경했는데 왜 오류 발생했다며 다시 시도하라는 글만 계속 띄움니까? 고의적으로 비번 변경 안되게 하는걸로 보이네요. 적어도 여러번 시도 했으면 로그인이 되야 될거 아닙니까.,1,T********,쿠팡
PLAY_coupang_001154,google_play,2025-12-19,정보 다털고 회원 탈퇴 란은 있어야지 무슨 도적놈 심보냐?,1,청*,쿠팡
