review_id,source,created_date,review_content,rating,author_masked,product_category
PLAY_coupang_001497,google_play,2025-12-09,와우 해지를 했는데 해지를 해야한다고 탈퇴를 못하게 하는건 뭔 개소립니까 탈퇴 버튼 꽁꽁 감춰놓은거에 들인 노력 반만이라도 보안에 썼으면 참 좋았겠다 그죠?,1,S**************,쿠팡
PLAY_coupang_001498,google_play,2025-12-09,탈퇴하세요 얼릉 전 이미 탈퇴했어요,1,s*********,쿠팡
PLAY_coupang_001500,google_play,2025-12-08,"주문내역 기간 필터 삭제는 사용자 경험을 크게 훼손하는 변경입니다. 지출 관리나 정산이 필요한 사용자 입장에서는 아예 사용이 불가능해졌습니다. 최근 업데이트로 핵심 기능이 사라졌고, 이로 인해 PC를 강제로 사용해야 하는 비효율까지 생겼습니다. 현재 UI는 명백히 문제이며 핵심 기능 저하로 보여지고 개선이 반드시 필요합니다.",1,이**,쿠팡
PLAY_coupang_001501,google_play,2025-12-08,진짜 당췌 이해가 안되네~ 보다 보면 버튼을 잘못눌러서 보던 페이지를 벗어날때가 있어서 '방금 본 상품 보기' 메뉴를 진짜 편리하게 잘 사용하고 있었는데 갑자기 사라졌네?? 대체 왜??? 찜목록에 검색기능 좀 넣어달라니까 아무 변화도 없더만 편하게 쓰던 메뉴까지 왜 없애버린거지??? 안그래도 물건 주문하고 하염없이 기다리다 한달반만에 일방적으로 주문취소 메시지받고 열받아서 항의해도 아무 책임 안져서 개빡치는데!! 개인정보 유출된것도 개빡치는데!! 잘 쓰던 메뉴까지 없애버려?? 아주 제발 쿠팡 쓰지말아달라고 고사를 지내네!!! 예~ 안써드릴께요~~!!! 아.. 지금 보니 구매한 제품 옵션정보도 없애버렸네? 얼마전에 산 바지 사이즈가 얼마였더라 확인할랬더니 옵션정보가 없네? 전엔 분명 내가 산 제품 사이즈나 색상같은 정보가 나왔는데 이제 아예 없네? 참 대단한 업데이트네~ 진짜 놀랍다 놀라워~ 어쩜 이렇게 업데이트 할수록 점점 불편해지게 만들수 있을까? 와우~~!!! 굿굿굿~!!!,1,이*,쿠팡
PLAY_coupang_001502,google_play,2025-12-08,원하는(100만원이상X) 물건 1개 90%로 할인 쿠폰,3,w****************,쿠팡
PLAY_coupang_001503,google_play,2025-12-08,한국 소비자 무시하는 쿠팡.. 안녕,1,렛**,쿠팡
PLAY_coupang_001504,google_play,2025-12-08,개인정보 털린 것에 대한 정당한 보상이나 해라.,1,최**,쿠팡
PLAY_coupang_001505,google_play,2025-12-08,멤버쉽 사용해왔는데 개인정보 털렸네요.,1,재*****,쿠팡
PLAY_coupang_001507,google_play,2025-12-08,폰을 부셔서 다른폰에서 로그인 하려니까 버그가 걸리네용ㅠㅠ,2,박**,쿠팡
PLAY_coupang_001508,google_play,2025-12-08,비닐백으로 택배올때 붙이는 택 제발 잘떼지게 해주세요 매번 비닐로 분리수거할때 이름붙은거 떼기가 너무힘들어서 가위로 잘라버려야 돼요,5,강**,쿠팡
PLAY_coupang_001511,google_play,2025-12-08,정보유출사태에 대한 무책임한 대응과 해결책에 대한 미흡한 향후 대책 등 더이상 사용할 수 없는 어플이 되었습니다.,1,권**,쿠팡
PLAY_coupang_001512,google_play,2025-12-08,카드 비번까지 바꿔야 하는 번거로움에 신상 정보 전국민 다털리고 뻔뻔히 장사질을 하네 보상 하나없이 진짜 두번다시 쿠팡쓰나봐라,1,진*******,쿠팡
PLAY_coupang_001513,google_play,2025-12-08,"허위광고, 와우회원 가입 유도, 개인정보 유출 후 뻔뻔한 태도.",1,연**,쿠팡
PLAY_coupang_001514,google_play,2025-12-08,"이름 전화번호 주소만 유출됐으니 안심하라는게 말이오 방구요? 국내 3,700만명 이상 사용자를 두면서 개인정보 유출할만큼 내부 시스템이 허술한건 돈버는데만 혈안되었다는거죠. 당신들 물류 직원들한테 개차반같이하고 쿠팡 로켓 BM들 셀러들한테 상납금받는거 만천하가 다 아는데 ... 빠른배송만 중요하죠? 다른건 눈에 뵈는게없지 미국기업! 통신사 정보유출 되었을때도 보상했는데 이번건 그냥 넘어가시면 안됩니다. 이름 주소 전화번호는 개인정보 아닌가요?",1,J***********,쿠팡
PLAY_coupang_001516,google_play,2025-12-08,쿠팡의 보안이 뚫려 개인정보가 유출된 이후 오늘 결제하고나서 바로 스팸의심 문자가 로켓으로 왔습니다,1,D***,쿠팡
PLAY_coupang_001517,google_play,2025-12-08,정신나간 대응덕에 정신차렸네요. 정리되는대로 탈퇴하겠습니다.,1,H***,쿠팡
PLAY_coupang_001518,google_play,2025-12-08,왜인지 알거에요. 진심으로 사과하고 재발 방지 대책 내놨으면 어지간하면 계속 썼겠죠.,1,B**,쿠팡
PLAY_coupang_001520,google_play,2025-12-08,진짜 너무 좋아요♡♡,5,이**,쿠팡
PLAY_coupang_001521,google_play,2025-12-08,개인정보 털려놓고 말로만 미안하다면 다냐 진짜 미안하면 할인쿠폰 좀 크게 뿌려라,1,K************,쿠팡
PLAY_coupang_001522,google_play,2025-12-08,"절대 알리, 테무는 안 쓴다",5,i*,쿠팡
PLAY_coupang_001524,google_play,2025-12-08,유출관련 보상도 없고 사과도 없어 책임지기도 싫어해 탈퇴한 계정은 파기도 안해 보안도 허술하게 관리하고 회사 내부에선 뮐 하고있나요?,1,W***********************,쿠팡
PLAY_coupang_001525,google_play,2025-12-08,로그인했는데 쿠폰이 안됌,1,신**,쿠팡
PLAY_coupang_001526,google_play,2025-12-08,인터넷광고나줄이셈 어째 유출터지고나서 광고가 더많아진거 같음? 뉴스를 볼라고해도 쿠팡앱들어가져 커뮤니티를들어가도 쿠팡광고가떠 예전보다 더뜨는거 같은데? 유출보다 이게더짱남,1,소*****,쿠팡
PLAY_coupang_001529,google_play,2025-12-08,유출인데 노출이라고 표현하는 쿠팡과 그 직원들의 무책임함에 정말 실망했습니다 2차피해를 막기위해 어떤 액션이 필요하냐 물어도 아직 피해본게 아니니 괜찮다는 고객센터의 발언 더이상 신뢰 할 수 없는 기업이네요,1,김**,쿠팡
PLAY_coupang_001530,google_play,2025-12-08,사과하나도 제대로 못하는 곳을 어떻게 믿겠습니까,1,ᄋ*,쿠팡
PLAY_coupang_001531,google_play,2025-12-08,개인정보보안 때문에 알리테무 안썼는데 이럴거면 쿠팡을 왜쓰냐? 회사 내부 뒷구멍으로 개인정보 숭숭 빠질 바에 그냥 내가 직접 갖다바치고 알리테무 쓰고말지,1,구*************,쿠팡
PLAY_coupang_001532,google_play,2025-12-08,마이페이지 안들어가져요 흰화면 뜨고 안들어가져요 어제부터 그러네요 해결좀 해주세요,1,안**,쿠팡
PLAY_coupang_001533,google_play,2025-12-08,개인정보 털려서 탈퇴해요,1,S************,쿠팡
PLAY_coupang_001534,google_play,2025-12-08,개인정보 피해보상해라,1,몽***,쿠팡
PLAY_coupang_001535,google_play,2025-12-08,"개인정보 유출 시켜놓고, 공동현관 비번 바꾸세요는 진짜 ㅋㅋㅋㅋㅋ 니네가 사람이냐? 어이가 없어서 ㅋㅋㅋㅋ",1,G************,쿠팡
PLAY_coupang_001536,google_play,2025-12-08,중국인 탓하고 중국탓하면 좋나요? 결국 본인들 위법저지르고 개인정보 폐기 요청 + 개인정보 불법유지 하는건 본인들인데 언플 잘하셨네요ㅋㅋㅋ 리뷰 보니 사람들도 잘 속아있네 사람들 어차피 얘네 탈퇴를하든 뭘하든 신경안써요 왜냐면 한번 저장된 개인정보 얘네 사업체 털릴때까지 갖고있거든ㅋㅋㅋ,1,ᄋ*,쿠팡
PLAY_coupang_001537,google_play,2025-12-08,빨리 2단계 인증 좀 만들어주세요. 불안해서 이거 살겠어요?,1,박**,쿠팡
PLAY_coupang_001538,google_play,2025-12-08,개인정보보호위원회(국번없이 118)에 신고! 쿠팡 한두번도 아니고 몇번째 털리는 거냐! 얼마나 보안에 신경을 안쓰면 중국인 직원을 쓰고 보안에 허술하게 몇번을 털리는지. 내 개인정보 알려주고 싶지 않은데. 쿠팡이나 쿠팡잇츠는 실명 이름으로 사용하게 되어있고 내정보 들어가면 비번 안치고도 내 주소 전번까지 다 나오게 되어있다. 아예 털어가라고 광고를 하지? 너무 화가 납니다! 이거 정신적 손해까지 쿠팡가입자들이 다 모여 손해배상 청구해야 됩니다. 다들 손해배상 청구합시다!!,1,H********,쿠팡
PLAY_coupang_001539,google_play,2025-12-08,"네,와우회원,개인정보 유출,해킹",5,강*********,쿠팡
PLAY_coupang_001540,google_play,2025-12-08,"쿠팡 너무 실망했습니다 개인정보도 그렇고, 전체적으로 빵점입니다",1,카******,쿠팡
PLAY_coupang_001541,google_play,2025-12-08,진짜 앱 그따위로 운영하지마라,1,게**,쿠팡
PLAY_coupang_001542,google_play,2025-12-08,요즘 안심을 못함 서비스만 좀 좋음,1,이***,쿠팡
PLAY_coupang_001543,google_play,2025-12-08,謝謝你給我們提供了有用的信息,1,김**,쿠팡
PLAY_coupang_001545,google_play,2025-12-07,5천만 인구 중 3천 7백만명 개인정보를 털렸는지 팔았는지 중국에 넘겨놓고 사과문만 띡 올리면 다냐? 피해보상도 없고 어이도 없다. 바로 와우 해지하고 쿠팡 탈퇴한다,1,이**,쿠팡
PLAY_coupang_001547,google_play,2025-12-07,Very bad shopping,1,Y******,쿠팡
PLAY_coupang_001548,google_play,2025-12-07,여기에서 개인정보 털리고 스팸전화 폭발중,1,귿**,쿠팡
PLAY_coupang_001550,google_play,2025-12-07,카드 등록시 카메라로 인식시킬 때 멈추는 현상은 뭔가요? 해킹?,1,S*********,쿠팡
PLAY_coupang_001551,google_play,2025-12-07,왜 자꾸 데이터 요청에 실패했다고 뜨나요? 비번 바꾸고 나서 앱으로 로그인이 안돼요 다시 지웠다 깔고 업데이트도 했는데 안돼요 웹으로는 잘되눈데 좀 고쳐주세요 ㅠㅠ,1,힐*****,쿠팡
PLAY_coupang_001553,google_play,2025-12-07,쿠팡을 개인정보가 유출되서 탈퇴했는데 그 전에 주문한 온풍기가 몇주째 오지 않고 있어요,3,마**,쿠팡
PLAY_coupang_001554,google_play,2025-12-07,2025-12-07 개인정보 3500만명이 떨렸으면 사과글이나 조치방법등 안내 페이지가 있어야 할게 아니냐 쿠팡의 부도덕함이 하늘을 찌르는구나. 김범석의 도덕성 수준 이겠지 ~~ ====== 이전글 ====== 다른 신문기사 사이트나 광고시 쿠팡광고는 X를 눌러도 종료가 안되고 사이트로 연결이 됩 쿠팡 광고 나오는 기사는 스킵을 하고 있음 쿠팡 광고 올리는 뉴스사이트나 기타 사이트들은 참고 하세요,1,테***,쿠팡
PLAY_coupang_001555,google_play,2025-12-07,정보나 팔아먹는..... 기업이라고도 부르기 아까운 것임ㅉㅉ. 내가 이런 곳에서 돈을 쓴게 후회됨. 최악임,1,달****,쿠팡
PLAY_coupang_001556,google_play,2025-12-07,이번 사태 때문에 비번좀 바꾸려하는데 로그인 되어있는데도 로그인 후 이용하라는데 왜그러죠?,1,정*,쿠팡
PLAY_coupang_001557,google_play,2025-12-07,쿠팡 화이팅! 한국인은 쿠팡,5,조**,쿠팡
PLAY_coupang_001559,google_play,2025-12-07,그냥 좀 비싸더라도 안전하게 다른곳 써야지 쿠팡 작별이다,1,w****,쿠팡
PLAY_coupang_001560,google_play,2025-12-07,힘내세요. 더욱 강화된 보완으로 강력한 쿠팡이 되길 응원하겠습니다. 파이팅,5,수****,쿠팡
PLAY_coupang_001561,google_play,2025-12-07,정보노출되것보상해주세요,1,김**,쿠팡
PLAY_coupang_001562,google_play,2025-12-07,좋았는데 실망이큽니다 잠잠해질때가 쿠팡사용안하려합니다 그동안 수고많으셨어요~,2,심**,쿠팡
PLAY_coupang_001563,google_play,2025-12-07,비닐포장에 붙은주소록 도저히 뜯을수가 없어요. 분리수거 해야하는데 정말 화가나요. 대책을부탁합니다.,1,이**,쿠팡
PLAY_coupang_001564,google_play,2025-12-07,제가 살면서 제일 어이없는 삶입니다 쿠팡이 무슨 와우아닌사람은 20000이상만 구매 가능하다고 합니다 와우아닌 사람은 무슨 거지로 보입니까? 언젠간 쿠팡 안씁니다.,1,들******,쿠팡
PLAY_coupang_001565,google_play,2025-12-07,보안 관리 안해서 사용자 정보 팔아치우는 기업,1,t*************,쿠팡
PLAY_coupang_001566,google_play,2025-12-07,"해킹에 털리고 점점 기능이 불편해지며, 불량품도 많은 편인데 검수하지 않고 싸지도 않습니다 와우 끝나면 삭제 후 다른곳으로 가야겠어요",1,나******,쿠팡
PLAY_coupang_001567,google_play,2025-12-07,저는 절대 테무와 알리를 쓰지 않을 것입니다.,5,김**,쿠팡
PLAY_coupang_001568,google_play,2025-12-07,"왜 내 이름, 전화번호, 주소, 이메일 싹 다 털렸다는걸 왜 아무렇지 않게 말하는거고 관심도 없는 쿠팡 비밀번호, 아이디는 멀쩡하니 안심하라는건가요..? 중국인이 쿠팡에 금전요구 안 했다. 사소한 피해다 같은 늬앙스로 말 돌리지마세요. 당연히 3000만명 개인정보 전부 중국이나 인도 캄보디아 같은 곳에 가져다 팔겠죠. 평소에 오지도 않던 스팸 전화가 하루에 3건이나 와요. 피해예방 이랍시고 11살 짜리 애들도 아는 당연한 소리는 제발 집어치우시고 제대로 된 해결책을 제시해주세요 단체로 고소 진행중이라는데 저도 참여하고 싶어지니까.",1,무***,쿠팡
PLAY_coupang_001569,google_play,2025-12-07,ㅋㅋㅋㅋㅋㅋㅋㅋㅋㅋㅋㅋㅋㅋㅋㅋㅋ더 떨어질게 있을까,1,스**,쿠팡
PLAY_coupang_001570,google_play,2025-12-07,"오늘 온 문자, 보이스피싱이 쿠팡 노출인지 유출인지 때문에 발생한건지는 보이스피싱 총책을 잡아도 모르지 않나요? 음지에서 누가 팔았는지도 모르게 팔았을 텐데...",1,림**,쿠팡
PLAY_coupang_001571,google_play,2025-12-07,"개인정보 털린거야 그렇다 치는데 무슨 광고성 알람 동의를 왜 이리 자주, 계솓 나오게 하는지 짜증이 나네. 어플 들어가서 좀만 만지면 계속 뜨니 이정도면 쓰지 말라고 고사지내는 수준인거 같네",1,D******,쿠팡
PLAY_coupang_001572,google_play,2025-12-07,보상안은 있는건가요? 개인정보를 너무 가볍게 여기는거 같아요,1,H*,쿠팡
PLAY_coupang_001573,google_play,2025-12-07,보안이 레기통 그자체,1,f******,쿠팡
PLAY_coupang_001574,google_play,2025-12-07,개인정보 유출하는 나쁜기업. 보안에 신경쓸 생각도 없어보임,1,J***********,쿠팡
PLAY_coupang_001576,google_play,2025-12-07,해킹 어플에 사과도 하는둥 마는둥,1,Y**,쿠팡
PLAY_coupang_001577,google_play,2025-12-07,개인정보 유출 실화?,1,H**********,쿠팡
PLAY_coupang_001578,google_play,2025-12-07,그런사태가 다시는 안생기게하쇼 우리한테 개인정보 주의사항 알리지말고 본인들이 주의사항들을 잘지키고하시고 비슷하고 싼업체있었음 바로그거썼을거요,1,김***,쿠팡
PLAY_coupang_001579,google_play,2025-12-07,안 쓴지 오래고 예전에 한 번 핸드폰 번호로 조회했을 때 일치 정보 없다고 나와서 휴면계정으로 탈퇴됐나보다 하고 살다가 이번 유출 소식 때문에 다시 들어왔습니다. 이름 번호 둘 다 넣는 칸에서 조회하니까 이메일 아이디가 나오더라고요. 그리고 나서 로그인이 계속 오류 나면서 안 되네요. 유출 건 때문에 비상 걸린 거야 알겠지만 로그인에서부터 오류가 나면 어쩝니까...,1,A***********,쿠팡
PLAY_coupang_001580,google_play,2025-12-07,어떠한 책임도 안지고 말만하는게 침 대단한 기업이네요 이번 유출로 무슨일 조금이라도 생기면 고소할거니까 그렇게 아세요,1,M****,쿠팡
PLAY_coupang_001581,google_play,2025-12-07,"개인정보 유출로 인해 기업이미지 신뢰도 급하락 및 대처, 보상 불만족",1,H,쿠팡
PLAY_coupang_001582,google_play,2025-12-07,개인정보 수정하려면 로그인했는데 로그인하라고 나와요,1,Y*********,쿠팡
PLAY_coupang_001583,google_play,2025-12-07,탈퇴했는데 개인정보 유출 관련 문자가 오는데 탈퇴해도 개인정보를 유지하고 이용하는건가요?,1,이**,쿠팡
PLAY_coupang_001584,google_play,2025-12-07,2025.12월현재국민3분의2개해킹됐다별1개도당연아깝다.책임지는행동보여라,1,박**,쿠팡
PLAY_coupang_001585,google_play,2025-12-07,탈쿠팡! 멤버십 해지하면서 해지사유조차 묻지 않고 해지되는건 얼탱이 없네. 개인정보 유출하고도 뻔뻔한 태도가 마음에 안들어서 나는 떠납니다!,1,이*,쿠팡
PLAY_coupang_001586,google_play,2025-12-07,쿠팡 고객의 개인정보가 소중한건 맞나? 처음에는 서버가 털린게 아니라 노출된 아이디 비밀번호로 들어가졌다고 하지 않았나? 전 고객의 개인정보가 털린거면 문제있지 않나 당신들 말 믿겠습니까? 문자를 왜 또 보내고 그러세요. 안믿습니다.,1,애*,쿠팡
PLAY_coupang_001587,google_play,2025-12-07,이찬원 아이고 🤦나도 봤어용,3,김**,쿠팡
PLAY_coupang_001588,google_play,2025-12-07,쿠팡 아프지말고 힘내자 이러니 저러니 해도 국내 원탑이다,5,W****,쿠팡
PLAY_coupang_001589,google_play,2025-12-07,아직 유출상태에 대해 정신 못차렸네,1,영***********,쿠팡
PLAY_coupang_001590,google_play,2025-12-07,사용자가 많아 접속이 안된다면서 다음에 접속 하라고 하는데 해결책을 알려 주세요,1,임*********,쿠팡
PLAY_coupang_001591,google_play,2025-12-07,쿠팡아 이메일관리 똑바로 안하냐? 재대로 하자,1,조**,쿠팡
PLAY_coupang_001592,google_play,2025-12-07,비밀번호 찾는 방법 등이 너무 불편해서,1,정**,쿠팡
PLAY_coupang_001593,google_play,2025-12-07,원래 이런거 잘안적는데 이번 유출로 힘들텐데 힘내라 쿠팡 개인정보유출로 여러곳에서 많이터졌는데 쿠팡은 못잡아먹어서 안달이네 (심하다심해) 물론유출이 잘못한건맞아도 (내정보도 포함임) 인스타등 여러곳 과하게잡도리하네 하던대로 앞으로 더열심히 가성비 굿 쿠팡으로 거듭나주십셔 아자아쟝 몰랑 난쿠팡좋앙,5,조**,쿠팡
PLAY_coupang_001595,google_play,2025-12-07,이번 오배송으로 2주 가까이 지체됐는데 그에 대한 보상도 따로 없고 정말 실망스럽습니다. 심지어 이번에 정보 유출사고까지 터졌더군요. 연달아 일이 터지니까 다시는 이용 안하고 싶어지네요.,1,김**,쿠팡
PLAY_coupang_001596,google_play,2025-12-07,개인정도 털린것같다 말만하지말고 보상점,1,이**,쿠팡
PLAY_coupang_001597,google_play,2025-12-07,안녕하세요. 왜서 어떤 상품은 로켓판매가 구매만 되고 일반판매가 구매는 안되는지요? 일반판매가 구매도 되게끔 개선해 주세요.!!!,5,박**,쿠팡
PLAY_coupang_001598,google_play,2025-12-07,개인정보 유출되서 굉장히 불편했구요 그거에 대해 보상도 없고 그냥 죄송하다 사과만한게 어이없었고 계속 와우회원 가입하라고 강요하고 물건 사고 배송오면 과대포장에다 택배봉투가 상태 안좋고 다 별로에요,1,박**,쿠팡
PLAY_coupang_001599,google_play,2025-12-07,구매 이외의 조작은 모두 불편. 탈퇴도 숨겨놓고. 정보 털린것도 감추기 급급하고. 다털렸는데 '덜' 털렸다고 감사하라는 문자나 보내고...,1,H*********,쿠팡
PLAY_coupang_001600,google_play,2025-12-07,모든걸 다 팔고 국민 개인정보는 무려 공짜로 중국에 뿌리는 최고의 어플,1,고**,쿠팡
PLAY_coupang_001601,google_play,2025-12-07,최악의 앱. 소비자 권리따위 1도 없음. 해지는 거의 불가능함. 회원정보관리는 최악. 와우멤버십은 당월해지 안됨.,1,K********,쿠팡
PLAY_coupang_001602,google_play,2025-12-07,개안정보 보안 0점,1,s********,쿠팡
PLAY_coupang_001603,google_play,2025-12-07,앱 자체는 좋지만 개인정보 달달털린 이슈로 탈퇴...,4,아***,쿠팡
PLAY_coupang_001604,google_play,2025-12-07,쿠팡 양심좀 있어라 쿠팡 탈퇴완료 별0개 주고싶다,1,몽*,쿠팡
PLAY_coupang_001605,google_play,2025-12-07,"개인정보유출됨, 사과문도없고 대처 실망,국민 기만",1,M************,쿠팡
PLAY_coupang_001606,google_play,2025-12-07,반품 환불이 잘되고 배송도 빠르고 믿을수 있습니다,5,박**,쿠팡
PLAY_coupang_001607,google_play,2025-12-07,갑자기 마이페이지가 먹통이에요 하얀 화면만 뜸...,3,민*,쿠팡
PLAY_coupang_001608,google_play,2025-12-07,데이터 요청에 실패했다고 로그인도 안됨 뭐하세요 진짜로? 앱 개판으로 만들었노,1,J*******,쿠팡
PLAY_coupang_001609,google_play,2025-12-07,최근본상품목록이 이번업데이트로사라졌어요 평소에 보던 최근본상품목록에서 구매하고하는데 이번에사라져서불편하네요,1,인********,쿠팡
PLAY_coupang_001610,google_play,2025-12-07,매국기업따위 빛삭하고 손절합니다,1,S********,쿠팡
PLAY_coupang_001611,google_play,2025-12-07,탈퇴도 못하게 하는 머 같은 앱 같으니라고,1,최*****************,쿠팡
PLAY_coupang_001612,google_play,2025-12-07,개인정보 유출된지 지났는데도 아무런 조치도 없는 회사...,1,송**,쿠팡
PLAY_coupang_001614,google_play,2025-12-06,해킹때문에 불안함 로켓프레시는 얼마이상 넘지 않으면 배송이 안되는게 억지로 필요하지 않거나 다른 물건을 구매하게 강요 하는거 같아서 너무 싫음,1,J****,쿠팡
PLAY_coupang_001615,google_play,2025-12-06,대한민국 소비자를 우롱하는 파렴치한 외국기업. 하루빨리 망하길 기도합니다. 일말의 사과도 없는 모습에 탈퇴를 결심합니다.,1,황**,쿠팡
PLAY_coupang_001616,google_play,2025-12-06,너무 마음에 들어요^^,1,하*,쿠팡
PLAY_coupang_001617,google_play,2025-12-06,개인정보유출.. 받지마셈,1,김**,쿠팡
PLAY_coupang_001619,google_play,2025-12-06,개인정보 다털렸어오ㅜ,1,K**********,쿠팡
PLAY_coupang_001620,google_play,2025-12-06,돈 벌려고만 하는 악덕기업 최악의 개인정보 유출 회원 탈퇴는 숨겨 놓는 건 뭔가요,1,Y************,쿠팡
PLAY_coupang_001621,google_play,2025-12-06,"내 정보 다 털렸다길래 결제수단 다 삭제하고 비번바꾸고 카드 다시 등록하려는데 카드 등록이 안됨. 카드 등록한다고 카메라,저장공간 권한 허락할수밖에 없게 만들더니, 카드 사진 안찍고 직접 입력하는것도 ㄱ계속 카메라 띄우면서 카메라로 카드번호 인식하더니 다시한번 카메라로 또 카드 찍고 인식했다가 또 찍고 무한반복, 도중에 직접입력으로 다시 하려해도 계속 카메라 띄우고는 다시 무한반복.",1,팀********,쿠팡
PLAY_coupang_001622,google_play,2025-12-06,보안관리잘해라 탈퇴완료,1,상****,쿠팡
PLAY_coupang_001623,google_play,2025-12-06,"옷을 새걸로 주문해도 중고반품상품이 옵니다!!! 가격은 새상품 가격으로 받고, 상품은 중고로 보내고... 도대체 이럴거면 구매할 때 새상품, 중고상품 가격 옵션이 왜 있는거죠? 다른 분들을 위해서 중고상품 구별법 남겨요. [바코드 2개가 ㄱ자 모양으로 한 스티커 위에 프린팅 되어있으면 RTO상품=다른 사람이 반품한 상품]입니다!!! RTO상품 받아서 몇 번이고 교환하고 새 걸로 보내달라해도 끝까지 RTO로 보내주네요... 이럴거면 돈이라도 일부 돌려주던가...",1,으**,쿠팡
PLAY_coupang_001624,google_play,2025-12-06,와우 결제유도 작작,1,조**,쿠팡
PLAY_coupang_001625,google_play,2025-12-06,쿠팡의 개인정보 사건으로 인해 피해가 갔다는 점을 문자로만 남기고 자세한 이유도 따지지 않고 따로 문구도 남기지 않는 다는 점에 대해서 매우 유감스럽게 생각합니다. 그런 태도를 가진 쿠팡 관련 회사들을 이용안할 예정입니다.,1,키**,쿠팡
PLAY_coupang_001626,google_play,2025-12-06,1년뒤에 다시 올게요,1,냠*,쿠팡
PLAY_coupang_001627,google_play,2025-12-06,해킹 당한거 본인 탓 아니라는데 제가 이용할 이유가 없어보이네요 어느 누가 개인정보 보호 못하는 곳을 믿고 쓰겠나요,1,귀**,쿠팡
PLAY_coupang_001628,google_play,2025-12-06,탈퇴하려고 다시 깔았다 수고해라,1,이**,쿠팡
PLAY_coupang_001630,google_play,2025-12-06,정보털리고 카드 재발행하고 뭔짓인지,1,T**********,쿠팡
PLAY_coupang_001632,google_play,2025-12-06,쿠팡 개인정보 유출 사태에 대해서 어떠한 책임도 안질려고함,1,허*,쿠팡
PLAY_coupang_001634,google_play,2025-12-06,정보 유출 때문에 '계정 설정-보안 및 로그인'에 들어가야 하는데 pc 등에서는 들어갈 수 없고 앱에서만 가능하다는 답변을 들었음. 쿠팡 유출로 난리난 건데 난 그것 때문에 쳐다보기도 싫은 쿠팡 앱을 이제서야 깔게 생겼네? 사고 나고 오히려 쿠팡 앱 설치자 수가 늘겠음ㅋㅋㅋ,1,손**,쿠팡
PLAY_coupang_001636,google_play,2025-12-06,개인정보 유출 사건 빨리 해결을 해주셨으면 합니다. 물론 탈퇴할거고 중학생때부터 사용했지만 이렇게 개인정보 관리 안하고 대책 안해주는 플랫폼은 처음봄.,1,정**,쿠팡
PLAY_coupang_001637,google_play,2025-12-06,물들어올때 노저어야지~ 쿠팡 망하게 생겼는데 컬리 네이버쇼핑 지마켓 뭐하냐~~,1,찬*,쿠팡
