review_id,source,created_date,review_content,rating,author_masked,product_category
PLAY_coupang_000401,google_play,2026-01-13,개인정보가 아무리 공공재라지만 해도 너무하네,1,동*,쿠팡
PLAY_coupang_000402,google_play,2026-01-13,애국기업 응원합니다. 와우회원 로켓배송 덕분에 삶의 질이 많이 올라갔어요. 앞으로도 자주 애용하겠습니다.,5,유*,쿠팡
PLAY_coupang_000404,google_play,2026-01-13,앱이 눌러도 형성이 안되요,1,이****,쿠팡
PLAY_coupang_000405,google_play,2026-01-13,웰컴 쿠폰 왜 안 나옴?,1,현*,쿠팡
PLAY_coupang_000406,google_play,2026-01-13,개인정보수집을 그렇게 많이하는데 보호를 못함,1,m******,쿠팡
PLAY_coupang_000407,google_play,2026-01-13,생각보다 맛이없음 초코가 거의없음,1,임**,쿠팡
PLAY_coupang_000408,google_play,2026-01-13,쿠팡 탈퇴한지 몇주가 지났는데 아직까지 내정보가 저장되어 있는 경우는 왜 그런걸까여? 이메일 주소와 비밀번호가 그대로 있던데...,1,s***,쿠팡
PLAY_coupang_000412,google_play,2026-01-12,쿠팡 최고 쿠팡 화이팅 쿠팡 응원해요!,5,강*******,쿠팡
PLAY_coupang_000413,google_play,2026-01-12,"아니, 쿠팡 유출도 되고 업뎃 이후로 사고 싶은 거 사려고 하면 로켓와우로 구매 이렇게 뜸 와우안하고싶은데 그럼 못 삼 짜증 남 스트레스받음. 일 년에 쿠팡 3번 쓸까 말까 한데 와우하면 걍 돈만 날림 또 와우하고 해지하고 또 와우하면 개 번거로움 그냥 돈 쓰게 두세요! 와우 필요 없음",1,영*,쿠팡
PLAY_coupang_000414,google_play,2026-01-12,쿠팡 응원합니다! 테X 알X 보다 배송도 빠르고 안전합니다. 가짜뉴스에 속지 않습니다. 미국기업 화이팅!,5,c****,쿠팡
PLAY_coupang_000416,google_play,2026-01-12,택배기사 싱품분실시 전혀책임을 묻지않은 쿠팡에게 감사드립니다 선진국으로 한걸음 발돋움 돼었습니다,5,덕****,쿠팡
PLAY_coupang_000417,google_play,2026-01-12,최근본 상품을 왜 없앰? 그거만 없앤다고 보안이 강화되는줄 아나보는데 ? 그거랑은 상관1도 없고 오히려 더 불편하게 하네요 실수로 나가기 하다 그 상품을 찾라 하거나 갑자기 최근에 본 상품이름은 생각 안나고 사진만 생각나는데 그 칸이 있을때는 바로 바로 찾아서 좋았는데 그거 없어지니까 찾는데 시간 잡아먹다 결국 짜증나서 찾기 포기합니다 진짜 너무 불편합니다 다시 원상복귀하세요,1,송**,쿠팡
PLAY_coupang_000418,google_play,2026-01-12,계속 쓰기에는 내 존엄성과 자존심의 가치가 너무 높다,1,J**************,쿠팡
PLAY_coupang_000419,google_play,2026-01-12,쿠팡 너무 좋아 없으면 못 살아,5,J****,쿠팡
PLAY_coupang_000420,google_play,2026-01-12,저는 다른 쇼핑몰 한번씩 검색하는데 달달이 등록비 없어도 제가 찾는건 없거나 비쌈.(제가 쿠팡에 괘씸한건 그 외국인 바지사장단의 동문서답과 또다른 김대표의 이상한 핑계로 도망다니기 바쁜 행태)좀 패주고 싶음. *저는 새벽배달이 아니어서 더 좋음(그래서 오후에만 배달되길 바람)♡,5,장**,쿠팡
PLAY_coupang_000421,google_play,2026-01-12,"1월 8일 업데이트가 있었나보네요. 제주도인데 원래 배송 안되면 체크가 안되야하는데 결제하기 넘어간 후에야 배송 안되는 제품 있다고 뜨고, 구매하려고 체크한 제품들이 품절 상태가 아닌데 체크가 취소되요. 아까 체크했으니 결제되겠지하고 확인하다보면 자꾸 체크가 풀려있어요.",1,율*,쿠팡
PLAY_coupang_000422,google_play,2026-01-11,쿠팡 하는 꼬라지도 별로인데 광고도 극혐이라 지움. 광고 끄려고 하는데 꼼수부려서 상품 터치되게 만들고 자꾸 앱 켜져서 광고 볼 때마다 빡쳐서 삭제하니까 구글플레이만 켜지고 끝나서 편함. 너네 광고 그딴식으로 계속 하면 다신 절대 안쓴다.,1,이**,쿠팡
PLAY_coupang_000424,google_play,2026-01-11,가지마ㅜㅜ쿠팡없음 못살아,5,H*********,쿠팡
PLAY_coupang_000425,google_play,2026-01-11,쿠팡탈퇴 안되게 막아놨나요? 앱들어가 개인정보 수정들어가던게 막혀서 탈퇴가 안되는데 이거 확인해주셔야겠는데요 이거 이슈화 안될려면 확인해주세요,1,앙***,쿠팡
PLAY_coupang_000427,google_play,2026-01-11,왜 결제만 하려하면 앱에 이상이 감지되었다고 뜨죠?,1,S***,쿠팡
PLAY_coupang_000428,google_play,2026-01-11,저는 선동 당하는 개돼지가 아니라 영원히 쿠팡과 같이 가겠습니다. 선동당하는 애들 나가니 더빠른 배송되겠네요 :),5,헬**,쿠팡
PLAY_coupang_000429,google_play,2026-01-11,여러분 로켓프레시 절대 이용하지 마세요!! 차라리 이마트 홈플러스 등의 대형마트 주문이 훨씬 편리합니다. 주문고객에게 계속 불편을 주는 전체 주문상품들을 갖다가 따로 따로 포장하는 형태가 개선될 때까지는 이용하지 말아야 합니다...,1,ロ*,쿠팡
PLAY_coupang_000430,google_play,2026-01-11,뭐라고?! 뭐라고?!?! 뭐라고?!?!?! 뭐라고?!?!?!?!?!?!?!?!?!?! 와우 아니면 결제가 안된다고?!?!?!?! 제가 공짜로 달라 한것도 아니고 돈 주고 사는데 와우가 아니면 결제가 안돼?!?!?!?!?!?!?!?!,1,a***,쿠팡
PLAY_coupang_000433,google_play,2026-01-11,연동 광고가 너무 심함. 개인 정보 유출로 불안해서 못씀.,1,심******,쿠팡
PLAY_coupang_000434,google_play,2026-01-11,"업데이트하니 찜한 상품 보기 이미지가 너무,커서 불편해요 ㅠ ㅜ 원래대로 작게보게 설정되게 해주세요!",3,S*********,쿠팡
PLAY_coupang_000436,google_play,2026-01-11,구매시마다 불량품 기스도 있고 매우 불편한 시스템 가지고 운영 새제품으로 많은것도 아니고 택배포장 마음에 안들게 보내주거나 여러모로 불편한점이 있어 별점 1개 요런곳은 처음때보다 고객만족도 점점 떨어지는곳,1,김**,쿠팡
PLAY_coupang_000437,google_play,2026-01-11,찜리스트 카테고리랑 최근 본 상품 왜 없앴냐,1,구*,쿠팡
PLAY_coupang_000438,google_play,2026-01-10,아니ㅋㅋㅋㅋㅋㅋ 멤버쉽 가입안하면 20000원 이상 구매해야 구매 되는게 말인가 진짜 그지같이 만들어놨네영,1,예**,쿠팡
PLAY_coupang_000439,google_play,2026-01-10,쿠폰 뿌리는 방식 보고 충격 먹음,1,청***,쿠팡
PLAY_coupang_000440,google_play,2026-01-10,일시적으로 사용자가 증가했다며 서비스 접속이 안된대요 몆주째 계속 이러는데 좀 고쳐주세요,3,d***,쿠팡
PLAY_coupang_000441,google_play,2026-01-10,이젠 쿠팡없이는 못살것같아요!!! 쿠팡을 살려야합니다!!!!!,5,진***,쿠팡
PLAY_coupang_000442,google_play,2026-01-10,최근본상품 탭 없앤다고 이미 일어난 유출이 없어지진 않아요... 다시 돌려놓으면 5점드림,1,s***,쿠팡
PLAY_coupang_000443,google_play,2026-01-10,쿠팡도 이미지검색있으면 좋을것같아요,1,김**,쿠팡
PLAY_coupang_000444,google_play,2026-01-10,미국기업이라서 좋습니다.,1,이**,쿠팡
PLAY_coupang_000445,google_play,2026-01-10,빠르게 오고 제품이 좋습니다.역시 쿠팡~^^,5,이**,쿠팡
PLAY_coupang_000446,google_play,2026-01-10,회사가 좀 ....,1,박**,쿠팡
PLAY_coupang_000448,google_play,2026-01-10,광고만 억지로 안뜨면 더 좋은 어플될듯,5,꼬*,쿠팡
PLAY_coupang_000449,google_play,2026-01-10,납치하지마라 광고로 돌아버리겠네 쓰레기같은앱,1,ᄀ*,쿠팡
PLAY_coupang_000450,google_play,2026-01-10,최근 일련의 사건으로 크게 실망했습니다.,1,말***,쿠팡
PLAY_coupang_000451,google_play,2026-01-10,쿠팡은 참 해킹만 아니였으면 좋은데..,2,처**********,쿠팡
PLAY_coupang_000452,google_play,2026-01-09,아니 로그인하는데 전화번호도 못쓰고 이메일도 안 보내주고 이건 쓰지 말라는거지?,1,유**,쿠팡
PLAY_coupang_000454,google_play,2026-01-09,토스뱅크를 사용하는데 물건을 샀을때 더 싸고 이쁜걸 찾아서 환불하고 다른걸 사려했지만 토스뱅크가 은행설정하는 것에 없어서 환불을 못받고있습니다.,1,황***,쿠팡
PLAY_coupang_000455,google_play,2026-01-09,데이터 요청에 실패했습니다. 오류는 어떻게 해결하나요? 삭제 후 재실행되어도 로그인할 때마다 안내문구가 뜨며 로그인이 안됩니다. 어플이 아닌 웹이나 pc로는 로그인이 정상적으로 되네요.. 🤔,1,이**,쿠팡
PLAY_coupang_000456,google_play,2026-01-09,개인정보 유출 아 진짜 나쁘네,1,남**,쿠팡
PLAY_coupang_000458,google_play,2026-01-09,택배기사 📦 들이 바쁜건 이해 하겠는데 물건을 던지는걸 목견한적도 있다 너무 한거 아니냐 점점 막나가네,3,F**************,쿠팡
PLAY_coupang_000459,google_play,2026-01-09,정보를 그따구로 털려놓고 사과같지도않은 사과문에 5만원 보상해준다고하면서 광고하고 뭐하자는거야 어쩐지 자꾸 쿠팡 명품어쩌구 광고가 뜨더라 에휴,1,l***********************,쿠팡
PLAY_coupang_000460,google_play,2026-01-09,"약속시간철저&본인가족에[앞으로도 계속 믿고 맡길수있도록 잘부탁드리며 응원] 직접전달&야무지게 상품을 포장해 ♥︎파손없이 갖다주셔서 ♥︎대단히 고맙습니다♥︎//배달기사(그래도 상담전화 친절&약속시간과 이상없는 물품상태는 다행) 연락처와 이름부터도 안나오고, 배송상황까지 고객이 눈치살펴야 되나, 문앞땅바닥 쳐던져두고 그냥간다(수시로 사이트들가봐야되고,배송도착후에야 나오고 _; 해서 중요한거를 계속 거래하기는 불안!! 어디쯤인지 위치파악도 안되고, 잃어버리거나 다른사람이 가져가면 책임질건가!?상당히 성의없는 태도와 심보들이 의문스럽게 불쾌아쉽!!이럴까봐, 분명히 직접전달및 전화나문자달라고 한건데//아무리 세상이 험난하다지만 이건아니지, 연락기록은 주고받아야지, 물건잘못된후 복잡하게 일하지 말고ㅉ배달들이 물려내고 회사들이 욕먹는 이유를 이해하겠다;-(이제는 안그럼)>본인에게 직접전달싫으면, 잠안자고 대문열어두었으면 집안에 마루위 갖다주어야죠~;?!이동네 거지많다고!",3,똑*******************************,쿠팡
PLAY_coupang_000461,google_play,2026-01-09,"사람들 왜케 불만이 많은지.. 쿠팡만큼 혜자어플 또 없는데 바라는게 많아, 잘쓰고있습니다",5,김**,쿠팡
PLAY_coupang_000463,google_play,2026-01-09,코팡이 있어 생활이 편리합니다,5,H**********,쿠팡
PLAY_coupang_000464,google_play,2026-01-08,후 아니 핸드폰을 시켰는데 갑자기 재고문제가 있다며 연락 다시 주겠다더니 안와서 기다림 근데 그냥 배송 왔길래 보니 색깔 기종 싹 다 다른게 옴 이게 맞음?? 아니 몇일이나 기다렸는데 이번만 잘못 온게 아니라 저번에 핸드폰 시켰을때도 주황색으로 오고.. 진짜 잘 좀 해주세요.,1,이***,쿠팡
PLAY_coupang_000465,google_play,2026-01-08,"혹시 개발자분 가정교육 받으신거 맞나요? 버튼 한번만 눌러도 바로 절차없이 와우회원 결제되게 한것도 잘 못다루는 사람이면 당황할만 한데, 해지하려고 하면 혜택이 사라진다느니 뭐니 겁을줘서 왜 사람 헷갈리게 하시나요? 다시 생각해도 화나네요 그따구로 장사하지마세요. 할머니가 손자 불러서 ""아이고 아들 갑자기 쿠팡에서 7000원을 쳐@뜯어갔는데 어떡해?"" 하는 그림이 상상이 안되나요?",1,시*,쿠팡
PLAY_coupang_000466,google_play,2026-01-08,쿠팡 화원가입 탈퇴했는데 왜 가입비가 빠져나갔는지???,1,곽**,쿠팡
PLAY_coupang_000468,google_play,2026-01-08,"직원 사망, 개인정보 유출",1,J*********,쿠팡
PLAY_coupang_000470,google_play,2026-01-08,구매내역 삭제 안해주고 와우 남은기간 해지 환불 1도없는 이상한 곳,1,M***,쿠팡
PLAY_coupang_000471,google_play,2026-01-08,이제 안씁니다. 고객을 어떻게 생각하는지 잘 알게되는 계기였습니다. 아 그리고 리뷰에 ㅋㅋㅋㅋ 알바생들인지 그냥 호구들인지 ㅋㅋ 응원한다는 사람들 있는데 인생 개멋있네요 ㅋㅋㅋㅋ,1,g****,쿠팡
PLAY_coupang_000472,google_play,2026-01-08,판매량순 정렬 왜 삭제했나요? 사기꾼들 더 판치게 하려고? ㅋ,5,J****************,쿠팡
PLAY_coupang_000473,google_play,2026-01-08,소비자를 기만하는 기업,1,김**,쿠팡
PLAY_coupang_000475,google_play,2026-01-08,쿠팡 힘내요!!!!!,5,문**,쿠팡
PLAY_coupang_000476,google_play,2026-01-08,반품처리가 넘안됨 중국앱 쓰는거보단 나을거같아서 쓰지만 소비자에대한 배려심이 부족한듯,3,김**,쿠팡
PLAY_coupang_000478,google_play,2026-01-08,와..;;아니 결제 버튼 누르면 바로 결제 되는게 조금 놀랍네요. 제가 통장에 있는 돈을 다른 데로 옮겨놔서 망정이지 한 번 눌러봤다가 바로 7천원을 강제로 낼 뻔했내요. 이거 시스템 개선해주셨으면 합니다. 저번에도 상품 구매할 때 고민하다가 잘못 누른 거 때문에 바로 결제돼서 너무 식겁했거든요. 이거 진짜 잘못된 시스템 같아요.,2,핸*,쿠팡
PLAY_coupang_000479,google_play,2026-01-07,잘 사용하고 있어요 제조국 표기를 눈에 확 들어오게 만들어 주시면 좋겠다는 바램입니다,5,G******,쿠팡
PLAY_coupang_000481,google_play,2026-01-07,제가 살려는걸 살려하면 다 와우회원을 가입해야 하더군요.. 이런 점 좀 개선해주시면 감사할 것 같네요..,3,강**,쿠팡
PLAY_coupang_000484,google_play,2026-01-07,아주 불친절하고 고객정보 유출시키는 회사,1,차*****,쿠팡
PLAY_coupang_000485,google_play,2026-01-07,"이 앱을 쓰면 개인정보 탈취 위험이 있어, 공익의 목적으로 리뷰를 씀",1,김*,쿠팡
PLAY_coupang_000486,google_play,2026-01-07,쿠팡 너무 좋아요 사랑해요,5,최**,쿠팡
PLAY_coupang_000487,google_play,2026-01-07,제 전화번호가 바뀌어서 제 개인설정에 들어가서 전화번호를 바꿀려고 하는데 로그인 후 이용할 수 있습니다! 라고 같은 메시지만 반복해서 나오네요 이미 계정 로그인이 되어있으니까 설정 들어가서 바꾸려는건데 중복 로그인을 시키려는 것도 아니고 이게 무슨 어불성설인지 모르겠네요 계속 제 이전 전화번호로 알림이 가게 되는데 어떻게 해결해야할 지 모르겠습니다,2,A***,쿠팡
PLAY_coupang_000488,google_play,2026-01-07,역겨운게 쿠폰을 카테고리 나눠놓고 몇천원씩 짤짤이로 뿌림ㅋㅋ 보상 선심쓰는척 돈이나 더 쓰라는 뜻,1,채*,쿠팡
PLAY_coupang_000490,google_play,2026-01-07,안 쓴다고는 못하겠지만 일단 깔껀까고,1,모**,쿠팡
PLAY_coupang_000491,google_play,2026-01-07,선동이 이리 무섭네요 리뷰들이 ㄷㄷ 이 기회에 한번쓰고 반품하는 그분들이 사라지기를,5,J**,쿠팡
PLAY_coupang_000492,google_play,2026-01-07,"자동업데이터를 체크 했어도 안됌. 항상 수동으로 업데이터 설치. 업데이터 할때마다 랙이 생김,필요없는 광고나옴, 내 프로필,닉네임 초기화로 바뀜, 문자알림(알림설정해도) 오지 안음. 항상 앱으로만 알림메세지 뜸, 매번 문제가 하나씩 생김! 꾸준하지 못한 쿠팡! 매번 같은 문제로 스트레스주는 쿠팡! 언제쯤 꾸준히 신경 안쓰게 해주실껀가요! 관리는 과연? 제대로 하는거 맞나요? 개인유출이나 당하고..ㅡㅡ 심각하너요!ㅡㅡ 문제가 많은쿠팡! 과연? 안심하고 계속 사용할수 있는지?ㅡㅡ 매번 신경쓰게하고 스트레스를 주시네요..ㅡㅡ",1,가***********,쿠팡
PLAY_coupang_000494,google_play,2026-01-07,실시간 위치 넣어라 좀 어렵냐 그게 최근 본 상품 넣어라 좀 어렵냐 그게,4,처*****,쿠팡
PLAY_coupang_000495,google_play,2026-01-06,삭제했습니다.. 정말 실망이 크네요..,1,이**,쿠팡
PLAY_coupang_000496,google_play,2026-01-06,편하고 싸고 좋아요,5,d*****,쿠팡
PLAY_coupang_000497,google_play,2026-01-06,모바일은 마이쿠팡 한달단위로 볼수있네,1,m***,쿠팡
PLAY_coupang_000498,google_play,2026-01-06,"쿠팡 화이팅!!ㅁ ㅕㄹ ㄱ ㅗㅇ.. 알리,테무XX쿠팡 애용OO 쿠팡 최고!!쿠팡잘못 1도 없다!!!",5,박**,쿠팡
PLAY_coupang_000500,google_play,2026-01-06,한국을 호구로 생각하는 쿠팡은 아웃,1,r*********,쿠팡
PLAY_coupang_000503,google_play,2026-01-06,업데이트되고 주문내역이 불편하게 됐네. 업데이트 하기전이 클릭 한번에 얼마썼는지 주문한 상품이 뭔지 딱 나왔는데 업데이트하고나서 주문내역 찾을려고 몇번을 눌러서 들어가야 되네. 왜 일을 어렵게 만들지?,1,안**,쿠팡
PLAY_coupang_000504,google_play,2026-01-06,"직장인이라 바쁜저에게는 쿠팡이 아주유용한 백화점이고 마트고 재래시장이고 때로는문방구고 케텐집,철물점,골프삽,그릇집,빵집,생선가게,반찬집,식자재마트(명절째 식자재 장보기 딱이예요ㅋㅋ) 급하게 필요한 물건도 검색하면 다음날바로 무거운짐들도 무료배송으로 집앞에까지 떡하니 가져다주시고 늘감사할따름입니다~ 혹시,맘에들지않거나 하자부분이 있을시는 반품이나 교환처리도 바로바로처리해주시는 배려는 구매자입장을 생각해주셔서 넘좋았습니다~구매후 적립되는 포인트도 마니마니괜찮은듯했는데ㅠ 이번 사태는 정말유감이지만 그동안 믿고쌓았던 신뢰로 저는 한번만더 쿠팡을 믿어볼까 합니다~ 그래야 또 쿠팡에서 고생하시는 모든분들도 힘이나실꺼 같거던요^^~(제개인적 의견입니다) 다들 힘내시길 바랍니다!!^^",5,이**,쿠팡
PLAY_coupang_000505,google_play,2026-01-06,"카페,기사까지 점령한 낚시성 광고글도 지긋지긋했는데 개인정보 유출에 뻔뻔한 태도, 납품업체 가격 올리라는 행태까지 ㅋㅋ 막장중에 막장이라 탈팡합니다. 굿바이",1,i*****,쿠팡
PLAY_coupang_000506,google_play,2026-01-06,업테이트바뀌고나서 더불편함 배송조회도그렇고 주문취소할려고하면 하나씩취소해야함 전에는 주문한번에취소가됐는데 업데이트하고나서 주무취소할때 일일히 하나씩다취소해야됨 너무불편함,2,박**,쿠팡
PLAY_coupang_000507,google_play,2026-01-06,화면확대는 갑자기 왜 안되게 해놨을까?,1,a*****,쿠팡
PLAY_coupang_000510,google_play,2026-01-05,그래. 한국에서 장사하기 싫다는데 무슨 말을 하겠냐. 난 가련다.,1,김**,쿠팡
PLAY_coupang_000511,google_play,2026-01-05,나는 와우회원이고 아내는 일반회원인데 아내가 와우회원은 더 싸게되냐며 링크를 보내줬는데 더 비싸더라능~~~ 내가 뭐하러 매달 9000원 가까이 돈을 내야하는지 모르겠슴,2,유**,쿠팡
PLAY_coupang_000512,google_play,2026-01-05,점점 올라오는 상품들이 형편없어지고 사기성 물건도 많음 진짜 깔보는 걸까요 쩝,5,이**,쿠팡
PLAY_coupang_000513,google_play,2026-01-05,악덕기업... 한국에서 꺼져라,1,시***,쿠팡
PLAY_coupang_000514,google_play,2026-01-05,비상계엄을 선포합니다,5,정**,쿠팡
PLAY_coupang_000515,google_play,2026-01-05,쿠팡와우 해제 신청,5,임**,쿠팡
PLAY_coupang_000516,google_play,2026-01-05,배송건으로 상담요청하면 맨날 미안하다 개선하겠다 말만하지 개선 1도 안됨 쿠팡기사들은 왜 요청사항을 안보지?,1,윤**,쿠팡
PLAY_coupang_000517,google_play,2026-01-05,아주좋은 흔들리지 맙시다!,5,k******,쿠팡
PLAY_coupang_000518,google_play,2026-01-05,최근 1~2년간 무언가 구매할 필요가 생기면 쿠팡 앱을 먼저 열게 됩니다. 최고입니다.,2,t*******,쿠팡
PLAY_coupang_000520,google_play,2026-01-05,애국 보수 쿠팡 화이팅,5,o******,쿠팡
PLAY_coupang_000521,google_play,2026-01-05,쿠팡 앱이 다운이 안됩니다 ㅜㅜ,3,달**,쿠팡
PLAY_coupang_000522,google_play,2026-01-05,진짜 이번에 느꼇습니다 별로네요,1,민**,쿠팡
PLAY_coupang_000523,google_play,2026-01-04,쇼핑 하기. 편하고 빠르고 가격 도 저렴해서 좋아요.,5,임**,쿠팡
PLAY_coupang_000526,google_play,2026-01-04,개인정보 빼가고 보상도 제대로 안하네ㅉㅉ,1,김**,쿠팡
PLAY_coupang_000527,google_play,2026-01-04,다시 쿠팡 등록하려는 안됌,1,김**,쿠팡
PLAY_coupang_000528,google_play,2026-01-04,쿠팡 뽜이팅~~~!!!,5,강**,쿠팡
PLAY_coupang_000529,google_play,2026-01-04,최근들어 상품상세에서 핀치줌이 안될때가 많습니다. 깨알같은 설명을 읽을수가 없을때도 많습니다. 빠른 개선바랍니다.,3,I**********,쿠팡
PLAY_coupang_000531,google_play,2026-01-04,우리 국민 개인정보는 공공재~^^,1,여***,쿠팡
PLAY_coupang_000532,google_play,2026-01-04,정말 사용이 불편합니다.,1,푸***,쿠팡
PLAY_coupang_000533,google_play,2026-01-04,중국 알바들 진짜 많네요ㅎㅎ? 평점 선동 대단하네?5G네요 진짜ㅋㅋ 뒷 돈 참 좋은가보다?,5,운*,쿠팡
PLAY_coupang_000535,google_play,2026-01-04,일부러 쿠팡 사용하고자 깔았습니다!!!!!!!!쿠팡 화이팅♡,5,크******,쿠팡
PLAY_coupang_000537,google_play,2026-01-03,아쉽네요...타플랫폼으로 옮기기로 결정했어요 ㅠㅠ,1,D**,쿠팡
PLAY_coupang_000538,google_play,2026-01-03,씹팡아 광고 죡같은거 그만좀 만들어라,1,동*,쿠팡
PLAY_coupang_000539,google_play,2026-01-03,개인정보 털린건 정말 기분이 나쁘지만 솔직히 제 개인정보는 이미 카드사든 어디든 안털린곳이 없어서 이제 기분이 나쁘지도 않아요 빨리빨리 배송되는것도 좋고 품질도 좋은게 많아요!,5,윤**,쿠팡
PLAY_coupang_000540,google_play,2026-01-03,화장품 시키니 실링 다 뜯어져있는 가짜가 옴 쿠팡 바이바이,1,임**,쿠팡
PLAY_coupang_000542,google_play,2026-01-03,쿠팡없이 어케 삶?,5,K***,쿠팡
PLAY_coupang_000543,google_play,2026-01-03,개인정보 유출후 처리하는게 나몰라,1,J****,쿠팡
PLAY_coupang_000544,google_play,2026-01-03,쿠팡 힘내요!!!!!!!,5,g***************,쿠팡
PLAY_coupang_000545,google_play,2026-01-03,로그인되있는데 지문로그인 왜계속뜨냐 빡치게 결국 비번찾아서 했는데. 지문으로만뜨고 비밀번호로그인은 뜨지도않네 뭐냐고 대체,1,아***,쿠팡
PLAY_coupang_000546,google_play,2026-01-03,회원탈퇴 완료. 대체할 쇼핑플렛폼은 충분하다,1,민**,쿠팡
PLAY_coupang_000547,google_play,2026-01-03,이번 사태로 인해 거지들과 간첩들을 구분하게 해주셔서 정말 감사합니다~더욱 열심히 사용할게요 쿠팡♡ 그리고 보상 뭐하러 해주시나요 안해줘도 그만인데 거지급여충 빨갠이들 탈팡한다더니 쿠폰준다니까 다시 가입 처한답니다 ㅋㅋㅋ,5,뚝****,쿠팡
PLAY_coupang_000548,google_play,2026-01-03,오늘 처음 쿠팡을 깔아서 회원가입을하려고하니까 이미 제 전화 번호랑 같으신분이 가입해서 가입이 안된다고하는데 어떻게 해야하나요.,1,이**,쿠팡
PLAY_coupang_000549,google_play,2026-01-03,배송 빠르고 좋아요 그나라 앱 아니라서 더 좋음,5,푸***,쿠팡
PLAY_coupang_000551,google_play,2026-01-03,쿠팡 탈퇴했다 다신 안쓴다,1,주**,쿠팡
PLAY_coupang_000552,google_play,2026-01-03,"다들 알리, 테무 쭝꿔짝퉁 싸구려 제품 쓰시면서 살길바랍니다~ 꺼져라~ 알리 테무 친원에 팔아도 안쓴다. 쿠팡이 백배 천배 좋지",4,주*,쿠팡
PLAY_coupang_000554,google_play,2026-01-02,오랜기간 애용했건만 최근 태도를 보고 탈퇴하고 앱삭제했음. 이땅에서 사업하면 안될듯..,1,노**,쿠팡
PLAY_coupang_000555,google_play,2026-01-02,한국의 암적인 존재 쿠팡.,1,S********,쿠팡
PLAY_coupang_000556,google_play,2026-01-02,개인정보 유출 반성하십시오.,1,윤**,쿠팡
PLAY_coupang_000558,google_play,2026-01-02,아쫌 광고 정말 악질이네 납치 정말 선을 넘네 저질임,1,김**,쿠팡
PLAY_coupang_000559,google_play,2026-01-02,개인정보 유출 반성하세요.,1,고**,쿠팡
PLAY_coupang_000560,google_play,2026-01-02,양심적으로 장사하세요,1,임**,쿠팡
PLAY_coupang_000561,google_play,2026-01-02,미국 회사라서 그런가 대한민국 사용자 개인정보 유출에 대해 미온하게 대응하시는 모습이 보기 좋습니다. 성업하시길~,1,M*****,쿠팡
PLAY_coupang_000562,google_play,2026-01-02,줫팡 내 개인정보어쩔꺼냐,1,볼***,쿠팡
PLAY_coupang_000563,google_play,2026-01-02,인터넷 광고창에 손가락 스치기만 해도 앱으로 납치하는거 좀 그만둬라. 장사 할 줄 모르는 가게가 홍보는 지저분하게하지.,1,남**,쿠팡
PLAY_coupang_000564,google_play,2026-01-02,쓰레기 기업 입니다 절때 이용 하지마 세요,1,최**,쿠팡
PLAY_coupang_000565,google_play,2026-01-02,좋습니다. 정보유출은 쿠팡의 책임이라기보다 악의적 스파이에 의한 것이죠. 쿠팡 힘내세요. 쿠팡을 지킵니다♡,5,제*,쿠팡
